{
  "schema": "dna-premium-evaluation-report",
  "version": "2.0",
  "source": {
    "previewSessionHash": "52f8172d96d4e097c48bcf702d15949094b51f0f7546b44d836dfe7354825545",
    "midiSha256": "4428e453d50cc6409922e47899abc06d2be49a0782e7b6f9f0334a979d0dcec3",
    "validatorIdentityHash": "36817ffb6820ed67956080212472b6830062b86dccf5f4bbdf19f17ed175e475",
    "songMapHash": "02de1496c1b6955d8bc0d0d0c6a6a5e9c44eaa1e5795ace93b7d3cc4e60aba5d",
    "baselineReferenceHash": "d56308f757471f94fc3b6911cffe44c5d56566b629a7be019d5074320c21ffd7",
    "blindPackageHash": "5a9ebf81cf8a82777d2c25dc017504d76d949de7476cf82de8235c20b9750293",
    "regressionVaultHash": "898897797ccb6d1490d4ad4a00ec95dea088870017ee74c0f4889eb65dce52c0"
  },
  "controls": {
    "version": "1.0",
    "premiumVariantId": "C",
    "minimumMetricScore": 2.5,
    "minimumAutomatedOverall": 3.5,
    "minimumHumanOverallMedian": 4.0,
    "minimumPremiumPreferenceRate": 0.7,
    "minimumHumanEvaluators": 2,
    "maximumHarmonyViolationRate": 0.45,
    "maximumRegisterCollisionRate": 0.12
  },
  "technical": {
    "passed": true,
    "hardFailures": [],
    "validatorPassed": true,
    "midiNotePeak": 7,
    "midiNoteCeiling": 54
  },
  "automated": {
    "variantId": "C",
    "metrics": {
      "harmony": {
        "score": 3.221,
        "facts": {
          "testedNoteCount": 137,
          "violationCount": 39,
          "violationRate": 0.284672,
          "unresolvedCount": 10,
          "examples": [
            {
              "noteUid": "exp-7698b57e82e5be9ce9e4",
              "pitch": 81,
              "chord": "C",
              "tick": 480
            },
            {
              "noteUid": "exp-4e82584be57cc6c6c02c",
              "pitch": 81,
              "chord": "C",
              "tick": 560
            },
            {
              "noteUid": "exp-17347833036b5857a6f0",
              "pitch": 79,
              "chord": "F",
              "tick": 1128
            },
            {
              "noteUid": "exp-b53fdb7d4b4db9e0ec57",
              "pitch": 71,
              "chord": "F",
              "tick": 1164
            },
            {
              "noteUid": "exp-4ae3359a5044b27b59b1",
              "pitch": 74,
              "chord": "F",
              "tick": 1440
            },
            {
              "noteUid": "exp-ef67e86dcec65b9eaec0",
              "pitch": 74,
              "chord": "F",
              "tick": 1520
            },
            {
              "noteUid": "exp-03fc864eb6395f5d11d2",
              "pitch": 70,
              "chord": "G7",
              "tick": 2052
            },
            {
              "noteUid": "exp-7a21739e18d9ce189811",
              "pitch": 72,
              "chord": "G7",
              "tick": 2088
            }
          ]
        },
        "explanation": "Chord-tone agreement at each note onset; drums and unresolved cells are excluded.",
        "weight": 0.2
      },
      "groove": {
        "score": 4.374,
        "facts": {
          "noteCount": 179,
          "gridTicks": 120,
          "meanAbsoluteDeviationTicks": 10.48,
          "strongOffGridRate": 0.044693
        },
        "explanation": "Onset stability relative to a 1/16 grid; expressive offsets remain measurable.",
        "weight": 0.16
      },
      "registerCollision": {
        "score": 4.796,
        "facts": {
          "overlappingCrossRolePairs": 392,
          "collisionCount": 4,
          "collisionRate": 0.010204,
          "examples": [
            {
              "firstNoteUid": "preview-src-7c531fce227a2dd87efb",
              "secondNoteUid": "exp-03fc864eb6395f5d11d2",
              "pitches": [
                71,
                70
              ]
            },
            {
              "firstNoteUid": "preview-src-7c531fce227a2dd87efb",
              "secondNoteUid": "exp-7a21739e18d9ce189811",
              "pitches": [
                71,
                72
              ]
            },
            {
              "firstNoteUid": "preview-src-31aba34bc4bcace315f7",
              "secondNoteUid": "exp-134227673e574147d87d",
              "pitches": [
                71,
                70
              ]
            },
            {
              "firstNoteUid": "preview-src-31aba34bc4bcace315f7",
              "secondNoteUid": "exp-e554976094b985be18c2",
              "pitches": [
                71,
                72
              ]
            }
          ]
        },
        "explanation": "Simultaneous cross-role semitone/unison congestion; same-role voicing is not penalized.",
        "weight": 0.14
      },
      "densityCurve": {
        "score": 3.783,
        "facts": {
          "sections": [
            {
              "sectionId": "sec-001",
              "label": "intro",
              "noteCount": 54,
              "durationTicks": 3840,
              "normalizedDensity": 1.0,
              "targetDensity": 0.55
            },
            {
              "sectionId": "sec-002",
              "label": "verse",
              "noteCount": 50,
              "durationTicks": 3840,
              "normalizedDensity": 0.925926,
              "targetDensity": 0.62
            },
            {
              "sectionId": "sec-003",
              "label": "chorus",
              "noteCount": 43,
              "durationTicks": 3840,
              "normalizedDensity": 0.796296,
              "targetDensity": 1.0
            },
            {
              "sectionId": "sec-004",
              "label": "ending",
              "noteCount": 32,
              "durationTicks": 3830,
              "normalizedDensity": 0.59414,
              "targetDensity": 0.58
            }
          ],
          "meanAbsoluteTargetError": 0.243442
        },
        "explanation": "Section density shape normalized within the candidate and compared with role-neutral targets.",
        "weight": 0.14
      },
      "transitionContinuity": {
        "score": 3.775,
        "facts": {
          "boundaryCount": 3,
          "boundaries": [
            {
              "tick": 3840,
              "fromSection": "sec-001",
              "toSection": "sec-002",
              "rolesBefore": [
                "drums",
                "solo"
              ],
              "rolesAfter": [
                "bass",
                "drums",
                "pad",
                "solo"
              ],
              "continuity": 0.5,
              "activity": 1.0,
              "boundaryScore": 0.79
            },
            {
              "tick": 7680,
              "fromSection": "sec-002",
              "toSection": "sec-003",
              "rolesBefore": [
                "drums",
                "solo"
              ],
              "rolesAfter": [
                "bass",
                "drums",
                "pad",
                "solo"
              ],
              "continuity": 0.5,
              "activity": 1.0,
              "boundaryScore": 0.79
            },
            {
              "tick": 11520,
              "fromSection": "sec-003",
              "toSection": "sec-004",
              "rolesBefore": [
                "drums"
              ],
              "rolesAfter": [
                "bass",
                "drums",
                "pad",
                "solo"
              ],
              "continuity": 0.25,
              "activity": 1.0,
              "boundaryScore": 0.685
            }
          ]
        },
        "explanation": "Activity and role continuity in one-quarter-note windows around section boundaries.",
        "weight": 0.14
      },
      "repetition": {
        "score": 3.929,
        "facts": {
          "barSignatureCount": 8,
          "duplicateCount": 0,
          "duplicateRate": 0.0
        },
        "explanation": "Exact role/onset/pitch-class bar repetition; moderate recurrence is treated as identity.",
        "weight": 0.08
      },
      "endingResolution": {
        "score": 5.0,
        "facts": {
          "lastNoteUid": "preview-src-7c1f7db3b297e81356ff",
          "pitch": 36,
          "pitchClass": 0,
          "keyRoot": 0,
          "endingChord": "C",
          "resolutionReason": "KEY_TONIC"
        },
        "explanation": "Final pitched note resolution against the ending chord and detected key tonic.",
        "weight": 0.14
      }
    },
    "categoryScores": {
      "drum": 4.079,
      "bass": 3.797,
      "guitar": 4.008,
      "accompaniment": 4.29,
      "solo": 4.111,
      "transition": 4.388,
      "overall": 4.088
    },
    "overallScore": 4.088,
    "method": "DETERMINISTIC_MIDI_STRUCTURE_ONLY",
    "humanListeningClaim": false,
    "passed": true,
    "lowMetrics": []
  },
  "listening": {
    "performed": false,
    "verifiedHumanEvaluatorCount": 0,
    "softwareTestResponseCount": 0,
    "trialDecisionCount": 0,
    "premiumPreferredCount": 0,
    "baselinePreferredCount": 0,
    "tieCount": 0,
    "premiumPreferenceRate": null,
    "categoryMedians": {
      "drum": null,
      "bass": null,
      "guitar": null,
      "accompaniment": null,
      "solo": null,
      "transition": null,
      "overall": null
    },
    "humanEvidenceOnly": true
  },
  "regression": {
    "openBaselineBetterCases": [],
    "passed": true
  },
  "releaseQualityGate": {
    "passed": false,
    "blockers": [
      "TWO_INDEPENDENT_HUMAN_EVALUATORS_REQUIRED",
      "HUMAN_OVERALL_MEDIAN_BELOW_FOUR_OR_MISSING",
      "PREMIUM_PREFERENCE_BELOW_SEVENTY_PERCENT_OR_MISSING"
    ],
    "requiresRealHumanEvidence": true,
    "proxyAudioCanSatisfyHumanGate": false
  },
  "status": "QUALITY_GATE_BLOCKED",
  "readOnly": true,
  "midiMutationAllowed": false,
  "finalMidiGenerated": false,
  "pa800DeviceCertified": false,
  "evaluationReportHash": "37da1a88fb03aa82c3c9a7273a6990d0fc69b0cd1b6d958867b94151fe98836e"
}
